{
  "$schema": "http://json-schema.org/draft-07/schema#",
  "$id": "https://factory-core.rychidesign/schemas/agent-signals/builder-result.schema.json",
  "title": "Builder result signal",
  "description": "Returned by every builder agent (frontend-builder, cms-builder, auth-builder, deployer, content-writer, …) at the end of a task. Strict JSON, no free text — see ADR-0007.",
  "type": "object",
  "additionalProperties": false,
  "required": [
    "schema_version",
    "signal_type",
    "status",
    "artifacts_created",
    "tests_passed",
    "summary",
    "metadata"
  ],
  "properties": {
    "schema_version": {
      "type": "string",
      "pattern": "^\\d+\\.\\d+(\\.\\d+)?$"
    },
    "signal_type": {
      "const": "builder-result"
    },
    "status": {
      "type": "string",
      "enum": ["complete", "partial", "failed"],
      "description": "complete = task fully done, all tests pass. partial = some artifacts created but task not finished (typically budget exhaustion). failed = no usable output."
    },
    "artifacts_created": {
      "type": "array",
      "items": { "type": "string" },
      "description": "Paths (relative to project root) of files the builder created or rewrote."
    },
    "artifacts_modified": {
      "type": "array",
      "items": { "type": "string" },
      "description": "Paths of files the builder edited but did not create."
    },
    "tests_passed": {
      "type": "boolean",
      "description": "Whether all relevant local tests/checks (build, type-check, lint, scoped tests) passed at the moment the agent returned."
    },
    "summary": {
      "type": "string",
      "minLength": 1,
      "description": "One-sentence summary of what was done. Surfaced in dashboard event feed."
    },
    "next_suggested_action": {
      "oneOf": [
        { "type": "null" },
        {
          "type": "string",
          "enum": ["continue-plan", "run-audit", "spawn-healer", "human-review"]
        }
      ],
      "description": "Hint to the orchestrator. The orchestrator may ignore it if its own logic disagrees."
    },
    "error": {
      "type": "object",
      "additionalProperties": false,
      "required": ["type", "message", "recovery_attempted"],
      "properties": {
        "type": {
          "type": "string",
          "description": "Stable error category (e.g. \"build-failure\", \"missing-component\", \"npm-install-failed\")."
        },
        "message": { "type": "string", "minLength": 1 },
        "recovery_attempted": { "type": "boolean" },
        "logs_excerpt": {
          "type": "string",
          "description": "Short tail of relevant log output that helps healer/operator diagnose."
        }
      },
      "description": "Present when status is \"partial\" or \"failed\"."
    },
    "metadata": {
      "type": "object",
      "additionalProperties": false,
      "required": ["agent", "duration_seconds", "tokens_used"],
      "properties": {
        "agent":            { "type": "string" },
        "duration_seconds": { "type": "number",  "minimum": 0 },
        "tokens_used":      { "type": "integer", "minimum": 0 },
        "model":            { "type": "string" },
        "task_id":          { "type": "string", "description": "Plan task id (e.g. \"T-021\")." }
      }
    }
  }
}
